key,en,fr,de,nl
FRONT_END.VALUE.DOCUMENT_TYPE.DESCRIPTIONS.LM_PROOF_OF_SAVING,"Please provide us with proof of the economic origin of the funds. As proof of professional savings, we expect this type of document, for example:<ul><li>Copy of the last salary slip</li><li>Recent accounts, if self-employed</li><li>Tax return</li><li>Bank statements showing the deposit of the last regular salary from a named employer</li><li>Certificate of sale of stock options from the employer</li><li>If the savings have been built up mainly as a result of a particular event (donation, inheritance, transfer of business, etc.), please refer to the supporting documents listed in the relevant category</li><li>If the savings were built up mainly through the professional activity of the subscriber, please refer to the relevant category</li></ul>","Comme justificatif d'épargne professionnelle, nous attendons par exemple ce type de document:<ul><li>Copie du dernier bulletin de salaire</li><li>Comptes récents, si travailleur à son compte</li><li>Déclaration d’impôts </li><li>Relevés bancaires indiquant le dépôt du dernier salaire régulier d’un employeur nommément cité</li><li>Attestation de vente de stock options de la part de l’employeur</li><li>Si l’épargne a été constituée principalement suite à un événement particulier (donation, succession, cession d’entreprise, etc.), merci de vous référer aux documents probants listés dans la catégorie concernée</li><li>Si l’épargne a été constituée principalement grâce à l’activité professionnelle du souscripteur, se référer à la catégorie concernée</li></ul>","Bitte legen Sie uns einen Nachweis über die wirtschaftliche Herkunft der Gelder vor. Als Nachweis für berufliche Ersparnisse erwarten wir z. B. diese Art von Dokumenten:<ul><li>Kopie der letzten Gehaltsabrechnung</li><li>Aktuelle Umsatz-/Gewinnzahlen, falls selbständig</li><li>Steuererklärung</li><li>Kontoauszüge, aus denen die Einzahlung des letzten regelmäßigen Gehalts von einem namentlich genannten Arbeitgeber hervorgeht</li><li>Bescheinigung des Arbeitgebers über den Verkauf von Aktienoptionen</li><li>Wenn die Ersparnisse hauptsächlich aufgrund eines bestimmten Ereignisses (Schenkung, Erbschaft, Unternehmensübertragung usw.) gebildet wurden, verweisen wir auf die in der Liste aufgeführten Belege.), verweisen wir auf die in der entsprechenden Kategorie aufgeführten Belege</li><li>Wurden die Ersparnisse hauptsächlich durch die berufliche Tätigkeit des Zeichners gebildet, verweisen wir auf die entsprechende Kategorie</li></ul>","Gelieve ons een bewijs te bezorgen van de economische origine van de fondsen. Als bewijs van professionele spaargeld verwachten wij dit type van document:ul><li>Kopie van laatste loonfiche</li><li>Recente rekeningen, indien zelfstandig</li><li>Aanslagbiljet</li><li>Bankuittreksels van de zichrekening met betrekking tot regelmatige salaris met de naam van de werkgever</li><li>Certificaat verkoop van aandeelopties van de werkgever</li><li>Indien de spaargelden hoofdzakelijk werd opgebouwd van uit een specifiek gebeurtenis (schenking, erfenis, zakelijke overdracht, etc.), gelieve de ondersteunende documenten te verwijzen naar de relevante categorieën</li><li>Indien de spaargelden hoofdzakelijk werd opgebouwd door professionele activiteit van de intekenaar, gelieve te verwijzen naar de relevante categorieën.</li></ul>"
FRONT_END.VALUE.DOCUMENT_TYPE.LM_COPY_PORTFOLIO,Proof of the realization of moveable assets,Preuve de la réalisation d'actifs mobiliers,Beweis für die Verwirklichung beweglicher Vermögenswerte,Bewijs van de realisatie van roerende activa
FRONT_END.VALUE.DOCUMENT_TYPE.LM_DECLARATION_INHERITANCE,Proof of the inheritance,Preuve de l'héritage,Beweis des Erbs,Bewijs van de erfenis
FRONT_END.VALUE.DOCUMENT_TYPE.LM_DEED_OF_GIFT,Proof of the donations/gifts,Preuve des donations,Nachweis der Spenden/Geschenke,Bewijs van schenkingen/giften
FRONT_END.VALUE.DOCUMENT_TYPE.LM_PROOF_OF_FUNDS,Proof of the origin of funds defined in the category 'Other',Justificatif de l'origine des fonds précisés dans la catégorie 'Autres',Beweis für den Ursprung der in der Kategorie 'Anderen' definierten Mittel,Bewijs van de oorsprong van de fondsen uit de categorie 'andere'
FRONT_END.VALUE.DOCUMENT_TYPE.LM_PROOF_OF_MARRIAGE,"Marriage certificate (if not established, copy of the family record book)",Contrat de mariage (à défaut livret de famille),"Heiratsurkunde (wenn nicht festgelegt, Kopie des Familienaufzeichnungsbuchs)","Huwelijksakte (indien niet gedefinieerd, kopie van het familieboekje)"
FRONT_END.VALUE.DOCUMENT_TYPE.LM_PROOF_OF_RESIDENCE,Proof of residence,Justificatif de domicile,Wohnsitznachweis,Bewijs van woonplaats
FRONT_END.VALUE.DOCUMENT_TYPE.LM_PROOF_OF_SALE,Proof of the proceeds of sale,Preuve de la vente,Nachweis des Verkaufserlöses,Bewijs van de verkoopopbrengsten
FRONT_END.VALUE.DOCUMENT_TYPE.LM_PROOF_OF_SAVING,Proof of the funds coming from savings,Preuve de fonds ayant comme origine l'épargne professionnelle,"Beweis für die Mittel, die aus Ersparnissen stammen",Bewijs van de fondsen die voortkomen uit spaargelden