key,en,fr,de,nl
FRONT_END.CONTENT.QUESTION_IDENTITY.desc,"{{ fspName }} thanks you for accompanying them with the entry and the update of your personal details by answering the questions below.<br>In this context, we ask you to:<ul><li>verify the prefilled information and adapt the data if they are not up-to-date, and</li><li>provide us with the other requested data.</li></ul><br>The first step consists of verifying your identity details.<br/>When you click on ""next"", the data completed on this page is saved. If you are disconnected or wish to resume the remediation later, none of the information you have entered will be lost.","{{ fspName }} vous remercie de l'accompagner dans le renseignement et la mise à jour de vos données personnelles en répondant aux questions ci-dessous.<br/>A ce titre, nous vous prions de bien vouloir :<ul><li>vérifier les informations déjà présentes et procéder aux modifications éventuelles si ces données ne sont plus à jour, et</li><li>renseigner les autres données.</li></ul><br/>La première étape consiste à vérifier vos données d'identité.<br/>Lorsque vous cliquez sur ""suivant"", les données complétées sur cette page sont enregistrées. Si vous êtes déconnecté ou si vous souhaitez reprendre la remédiation plus tard, aucune des informations que vous avez renseignées ne sera perdues.","{{ fspName }} bedankt sich bei Ihnen für die Unterstützung bei der Eingabe und dem Update Ihrer persönlichen Daten durch die Beantwortung der unten stehenden Fragen.<br/>In diesem Zusammenhang bitten wir Sie:<ul><li>bestätigen Sie die vorausgefüllten Informationen und passen Sie die Daten an, sofern sie nicht aktuell sind und</li><li>übermitteln Sie die anderen angeforderten Daten.</li></ul><br/>Der erste Schritt ist die Bestätigung Ihrer Identitätsdetails.<br/>Wenn Sie auf ""weiter"" klicken, werden die auf dieser Seite festgelegten Daten gespeichert. Wenn Sie nicht verbunden sind oder die Verbesserung später fortsetzen möchten, gehen die Daten, die Sie bisher eingeführt haben, nicht verloren.","{{ fspName }} dankt jou voor het aanleveren en aanpassen van jouw persoonsgegevens met het beantwoorden van onderstaande vragen.<br>In die context, vragen we jou om:<ul><li>de bestaande informatie te controleren en te wijzigen indien deze niet meer actueel zijn, en</li><li>de overige gegevens aan te vullen.</li></ul><br>De eerste stap bestaat uit het verifiëren van jouw identiteitsgegevens. <br/>Wanneer u op ""volgende"" klikt, worden de ingevulde gegevens op deze pagina opgeslagen. Indien de verbinding wordt verbroken of indien je de remediëring later wilt hervatten, gaat geen van de door jouw ingevoerde informatie verloren."
FRONT_END.CONTENT.REGISTER,,,,
FRONT_END.CONTENT.SHARED.TERMS.termsOfUseLink,,,,
FRONT_END.CONTENT.SMS_REGISTRATION.REGISTER.description,"Please enter your mobile number, so your personal information can be completed","Veuillez entrer votre numéro de téléphone mobile, afin que vos informations personnelles puissent être complétées","Bitte geben Sie Ihre Handynummer ein, damit Ihre persönlichen Daten vervollständigt werden können.",Gelieve jouw mobiele nummer in te voeren om je persoonlijke informatie te vervolledigen.
FRONT_END.LABEL.confirmProfileAcceptTerms,"I understand and accept the <a href=""https://s3-luxembourg.obj.ebrc.com/harmoney-public/static/lamondiale/taxcompliance-en.pdf"" target=""_blank"">terms regarding tax compliance</a>","Je comprends et accepte les <a href=""https://s3-luxembourg.obj.ebrc.com/harmoney-public/static/lamondiale/taxcompliance-fr.pdf"" target=""_blank"">conditions de conformité fiscale</a>","Ich habe die <a href=""https://s3-luxembourg.obj.ebrc.com/harmoney-public/static/lamondiale/taxcompliance-en.pdf"" target=""_blank"">Geschäftsbedingungen</a> verstanden und akzeptiere diese.","Ik begrijp en aanvaard de <a href=""https://s3-luxembourg.obj.ebrc.com/harmoney-public/static/lamondiale/taxcompliance-en.pdf"" target=""_blank""algemene voorwaarden</a>"
FRONT_END.LABEL.dateOfBirth,Date of birth,Né(e) le ,Geburtsdatum,Geboortedatum
FRONT_END.LABEL.industrySector,Sector of activity ,Secteur d’activité ,Tätigkeitsbereich,Sector van activiteit
FRONT_END.LABEL.lastName,Birth name,Nom de naissance,Name,Naam
FRONT_END.LABEL.placeOfBirth,Place of birth,à,Geburtsort,Geboorteplaats
FRONT_END.LABEL.socialState,Social state,Poste occupé,Sozialer Status,Sociaal statuut
FRONT_END.TITLE.COMPONENT.SMS_REGISTRATION.REGISTER,"The update of your personal information is almost complete, {{name}}!",La mise à jour de vos informations personnelles est désormais bientôt terminée,"Die Aktualisierung Ihrer persönlichen Daten ist fast abgeschlossen, {{name}}!","De update van je persoonlijke informatie is bijna compleet, {{name}}!"
FRONT_END.VALUE.DOCUMENT_TYPE.PROOF_OF_RESIDENCE,Proof of residence,Justificatif de domicile,Wohnsitznachweis,Bewijs van woonplaats
FRONT_END.VALUE.DOCUMENT_TYPE.DESCRIPTIONS.LM_COPY_PORTFOLIO,"Please provide us with proof of the economic origin of the funds. As proof, we expect for example this type of document (duly signed document + indication of the amount):<ul><li>Copy of the securities portfolio statement</li></ul>","Comme justificatif, nous attendons par exemple ce type de document(document dûment signé+indication du montant): <ul><li>Copie du relevé de Portefeuille titres et historique montrant le désinvestissement des titres dans le cadre de la présente liquidation</li></ul>",Bitte legen Sie uns einen Nachweis über die wirtschaftliche Herkunft der Gelder vor. Als Nachweis erwarten wir z. B. diese Art von Dokument (ordnungsgemäß unterzeichnetes Dokument + Angabe des Betrags):<ul><li>Kopie des Wertpapierdepotauszugs</li></ul>,Gelieve ons een bewijs te bezorgen van de economische origine van de fondsen. Als bewijs verwachten wij dit type van document (Geldig getekend + indicatie van het bedrag):ul><li>Kopie van de uittreksels van de effectenrekening</li></ul>
FRONT_END.VALUE.DOCUMENT_TYPE.DESCRIPTIONS.LM_DECLARATION_INHERITANCE,"Please provide us with proof of the economic origin of the funds. As proof, we expect this type of document (duly signed document + indication of the amount): <ul><li>Deed of Succession showing the amount allocated to the client</li><li>Notarised will with indication of the amount allocated to the client</li><li>Cerfa 2705 stamped by the tax authorities or accompanied by the acknowledgement of receipt of the e-mail</li></ul>","Comme justificatif, nous attendons par exemple ce type de document (document dûment signé+indication du montant):<ul><li>Acte de succession reprenant le montant attribué au client</li><li>Testament visé par le notaire avec mention du montant attribué au client</li><li>Cerfa 2705 estampillé par l'administration fiscale ou accompagné de l’accusé de réception du mail</li></ul>","Bitte legen Sie uns einen Nachweis über die wirtschaftliche Herkunft der Gelder vor. Als Nachweis erwarten wir diese Art von Dokument (ordnungsgemäß unterzeichnetes Dokument + Angabe des Betrages): <ul><li>Erbvertrag, aus dem der dem Kunden zugewiesene Betrag hervorgeht</li><li>Notarielles Testament mit Angabe des dem Kunden zugewiesenen Betrages</li><li>Cerfa 2705-Formular mit Stempel der Steuerbehörde oder mit der Empfangsbestätigung der E-Mail</li></ul>",Gelieve ons een bewijs te bezorgen van de economische origine van de fondsen. Als bewijs verwachten wij dit type van document (Geldig getekend + indicatie van het bedrag): ul><li>Akte van erfopvolging met het toegewezen bedrag aan de klant</li><li>Genotariseerd testament met het toegewezen bedrag aan de klant</li><li>Cerfa 2705 bestempeld door de belastingsinstanties of door een erkenning van een ontvangstbevestiging per mail</li></ul>
FRONT_END.VALUE.DOCUMENT_TYPE.DESCRIPTIONS.LM_DEED_OF_GIFT,"Please provide us with proof of the economic origin of the funds. As proof, we expect this type of document (duly signed document + indication of the amount):<ul><li>Notarised deed of gift</li><li>In France, the declaration form for manual donations (Cerfa 2735 stamped by the tax authorities or accompanied by the acknowledgement of receipt of the email)</li></ul>","Comme justificatif, nous attendons par exemple ce type de document (document dûment signé+indication du montant):<ul><li>Acte de donation notarié</li><li>En France, Formulaire de déclaration de dons manuels (Cerfa 2735 estampillé par l'administration fiscale ou accompagné de l’accusé de réception du mail)</li></ul>",Bitte legen Sie uns einen Nachweis über die wirtschaftliche Herkunft der Gelder vor. Als Nachweis erwarten wir diese Art von Dokument (ordnungsgemäß unterzeichnetes Dokument + Angabe des Betrags):<ul><li>Notariell beglaubigte Schenkungsurkunde</li><li>In Frankreich das Erklärungsformular für manuelle Spenden (Cerfa 2735 mit Stempel der Steuerbehörde oder mit der Empfangsbestätigung der E-Mail)</li></ul>,Gelieve ons een bewijs te bezorgen van de economische origine van de fondsen. Als bewijs verwachten wij dit type van document (Geldig getekend + indicatie van het bedrag): ul><li>Schenkingsakte</li><li>In Frankrijk het verklaringsformulier van manuele schenking (Cerfa 2735 bestempeld door de belastingsinstanties of door een erkenning van een ontvangstbevestiging per mail)</li></ul>
FRONT_END.VALUE.DOCUMENT_TYPE.DESCRIPTIONS.FATCA_FOREIGN_STATUS_OF_BENEFICIAL_OWNER,"Add the document 'FATCA - Certificate of Foreign Status of Beneficial Owner for United States Tax Withholding and Reporting (form W-8ben)'. The document can be downloaded <a href=""http://www.irs.gov/pub/irs-pdf/fw8ben.pdf"" target=""_blank"">here</a>.<br><br>You already have the FATCA form completed and signed on your computer, please attach this document by clicking on <b>'Add '</b>.<br><br>You do not have the completed electronic form? Please follow the steps below: <ul><li>download the form corresponding to your situation</li><li>print the document and complete it</li><li>scan the document and save it on your computer</li><li>click on <b>'Add'</b></li></ul>","Ajouter le formulaire 'FATCA - Certificate of Foreign Status of Beneficial Owner for United States Tax Withholding and Reporting (form W-8ben)'. Vous trouverez le formulaire <a href=""http://www.irs.gov/pub/irs-pdf/fw8ben.pdf"" target=""_blank"">ici</a>.<br/><br/>Vous disposez déjà du formulaire Fatca rempli et signé sur votre ordinateur, merci de joindre ce document en cliquant sur <b>‘Ajouter’</b>.<br/><br/>Vous ne disposez pas du formulaire rempli en version électronique. Merci alors de suivre les démarches suivantes : <ul><li>téléchargez le formulaire correspondant à votre situation</li><li>imprimez le document et remplissez le</li><li>ensuite scannez le document et enregistrez le sur votre ordinateur</li><li>cliquez sur <b>‘Ajouter’</b></li><ul>","Fügen Sie das folgende Dokument hinzu: 'FATCA – Bescheinigung über den Ausländerstatus des wirtschaftlich Berechtigten für die US-Quellsteuer und zum Zwecke der Meldung (Formular W-8ben) (Certificate of Foreign Status of Beneficial Owner for United States Tax Withholding and Reporting)'. Das Dokument kann <a href=""http://www.irs.gov/pub/irs-pdf/fw8ben.pdf"" target=""_blank"">hier</a> heruntergeladen werden.<br/><br/>Sie haben das FATCA-Formular bereits unterschrieben auf Ihrem Computer? Dann fügen Sie das Dokument hinzu, indem Sie auf <b>'Hinzufügen'</b> klicken.<br/><br/>Sie haben nicht das vervollständigte elektronische Formular? Bitte führen Sie die unten beschriebenen Schritte durch: <ul><li>laden Sie das zu Ihrer Situation passende Formular herunter</li><li>drucken Sie das Dokument aus und vervollständigen Sie es</li><li>scannen Sie es ein und speichern es auf Ihrem Computer</li><li>klicken Sie dann auf <b>'Hinzufügen'</b></li></ul>","Voeg het document 'FATCA - Certificate of Foreign Status of Beneficial Owner for United States Tax Withholding and Reporting (form W-8ben)' toe. Dit document is <a href=""http://www.irs.gov/pub/irs-pdf/fw8ben.pdf"" target=""_blank"">hier</a> beschikbaar.<br><br>Je hebt reeds het FATCA formulier ingevuld en getekend op jouw computer staan, gelieve deze op te laden door te klikken op <b>‘Toevoegen’</b>.<br><br>Je hebt het elektronische formulier niet ingevuld? Gelieve volgende stappen te volgen: <ul><li>download het formulier dat overéénkomt met jouw situatie</li><li>druk het document af en vervolledig het</li><li>scan het document en bewaar het op jouw computer</li><li>klik op <b>‘Toevoegen’</b></li></ul>"
FRONT_END.VALUE.DOCUMENT_TYPE.DESCRIPTIONS.FATCA_LOSS_OF_NATIONALITY,"Add the document 'FATCA - The Certificate of Loss of Nationality of the United States (form DS-4083)'. The form can be downloaded <a href=""https://eforms.state.gov/Forms/ds4083.pdf"" target=""_blank"">here</a>.<br><br>You already have the FATCA form completed and signed on your computer, please attach this document by clicking on <b>'Add'</b>.<br><br>You do not have the completed electronic form? Please follow the steps below: <ul><li>download the form corresponding to your situation</li><li>print the document and complete it</li><li>scan the document and save it on your computer</li><li>click on <b>'Add'</b></li></ul>","Ajouter le formulaire 'FATCA - The Certificate of Loss of Nationality of the United States (form DS-4083)'. Vous trouverez le formulaire <a href=""https://eforms.state.gov/Forms/ds4083.pdf"" target=""_blank"">ici</a>.<br/><br/>Vous disposez déjà du formulaire Fatca rempli et signé sur votre ordinateur, merci de joindre ce document en cliquant sur <b>‘Ajouter’</b>.<br/><br/>Vous ne disposez pas du formulaire rempli en version électronique. Merci alors de suivre les démarches suivantes : <ul><li>téléchargez le formulaire correspondant à votre situation</li><li>imprimez le document et remplissez le</li><li>ensuite scannez le document et enregistrez le sur votre ordinateur</li><li>cliquez sur <b>‘Ajouter’</b></li><ul>","Fügen Sie das folgende Dokument hinzu: 'FATCA – Bescheinigung über den Verlust der US-Staatsangehörigkeit (Formular DS-4083) (Certificate of Loss of Nationality of the United States)'. Das Formular kann <a href=""https://eforms.state.gov/Forms/ds4083.pdf"" target=""_blank"">hier</a> heruntergeladen werden.<br/><br/>Sie haben das FATCA-Formular bereits unterschrieben auf Ihrem Computer? Dann fügen Sie das Dokument hinzu, indem Sie auf <b>'Hinzufügen'</b> klicken.<br/><br/>Sie haben nicht das vervollständigte elektronische Formular? Bitte führen Sie die unten beschriebenen Schritte durch: <ul><li>laden Sie das zu Ihrer Situation passende Formular herunter</li><li>drucken Sie das Dokument aus und vervollständigen Sie es</li><li>scannen Sie es ein und speichern es auf Ihrem Computer</li><li>klicken Sie dann auf <b>'Hinzufügen'</b></li></ul>","Voeg het document 'FATCA - The Certificate of Loss of Nationality of the United States (form DS-4083) toe. Dit document is <a href=""https://eforms.state.gov/Forms/ds4083.pdf"" target=""_blank"">hier</a> beschikbaar.<br><br>Je hebt reeds het FATCA formulier ingevuld en getekend op jouw computer staan, gelieve deze op te laden door te klikken op <b>‘Toevoegen’</b>.<br><br>Je hebt het elektronische formulier niet ingevuld? Gelieve volgende stappen te volgen: <ul><li>download het formulier dat overéénkomt met jouw situatie</li><li>druk het document af en vervolledig het</li><li>scan het document en bewaar het op jouw computer</li><li>klik op <b>‘Toevoegen’</b></li></ul>"
FRONT_END.VALUE.DOCUMENT_TYPE.DESCRIPTIONS.FATCA_REQUEST_TIN,"Add the document 'FATCA - Request for Taxpayer Identification Number and Certification (form W-9)'. The form can be downloaded <a href=""http://www.irs.gov/pub/irs-pdf/fw9.pdf"" target=""_blank"">here</a>.<br><br>You already have the FATCA form completed and signed on your computer, please attach this document by clicking on <b>'Add'</b>.<br><br>You do not have the completed electronic form? Please follow the steps below: <ul><li>download the form corresponding to your situation</li><li>print the document and complete it</li><li>scan the document and save it on your computer</li><li>click on <b>'Add'</b></li></ul>","Ajouter le formulaire 'FATCA - Request for Taxpayer Identification Number and Certification (form W-9)'. Vous trouverez le formulaire <a href=""http://www.irs.gov/pub/irs-pdf/fw9.pdf"" target=""_blank"">ici</a>.<br/><br/>Vous disposez déjà du formulaire Fatca rempli et signé sur votre ordinateur, merci de joindre ce document en cliquant sur <b>‘Ajouter’</b>.<br/><br/>Vous ne disposez pas du formulaire rempli en version électronique. Merci alors de suivre les démarches suivantes : <ul><li>téléchargez le formulaire correspondant à votre situation</li><li>imprimez le document et remplissez le</li><li>ensuite scannez le document et enregistrez le sur votre ordinateur</li><li>cliquez sur <b>‘Ajouter’</b></li><ul>","Fügen Sie das folgende Dokument hinzu: 'FACTA – Antrag auf Steuerzahler-Identifikationsnummer und Bescheinigung (Formular W-9) (Request for Taxpayer Identification Number and Certification)'. Das Formular kann <a href=""http://www.irs.gov/pub/irs-pdf/fw9.pdf"" target=""_blank"">hier</a> heruntergeladen werden.<br/><br/>Sie haben das FATCA-Formular bereits unterschrieben auf Ihrem Computer? Dann fügen Sie das Dokument hinzu, indem Sie auf <b>'Hinzufügen'</b> klicken.<br/><br/>Sie haben nicht das vervollständigte elektronische Formular? Bitte führen Sie die unten beschriebenen Schritte durch: <ul><li>laden Sie das zu Ihrer Situation passende Formular herunter</li><li>drucken Sie das Dokument aus und vervollständigen Sie es</li><li>scannen Sie es ein und speichern es auf Ihrem Computer</li><li>klicken Sie dann auf <b>'Hinzufügen'</b></li></ul>","Voeg het document 'FATCA - Request for Taxpayer Identification Number and Certification (form W-9) toe. Dit document is <a href=""http://www.irs.gov/pub/irs-pdf/fw9.pdf"" target=""_blank"">hier</a> beschikbaar.<br><br>Je hebt reeds het FATCA formulier ingevuld en getekend op jouw computer staan, gelieve deze op te laden door te klikken op <b>‘Toevoegen’</b>.<br><br>Je hebt het elektronische formulier niet ingevuld? Gelieve volgende stappen te volgen: <ul><li>download het formulier dat overéénkomt met jouw situatie</li><li>druk het document af en vervolledig het</li><li>scan het document en bewaar het op jouw computer</li><li>klik op <b>‘Toevoegen’</b></li></ul>"
FRONT_END.VALUE.DOCUMENT_TYPE.DESCRIPTIONS.LM_PROOF_OF_FUNDS,We expect for example:<ul><li>Supporting documents according to the nature of the funds</li><li>Signed letter from a chartered accountant detailing the income received</li></ul>,Nous attendons par exemple:<ul><li>Documents justificatifs suivant la nature des fonds</li><li>Lettre signée d’un comptable agréé détaillant les revenus perçus</li></ul>,"Wir erwarten zum Beispiel:<ul><li>Belege je nach Art der Gelder</li><li>Unterzeichnetes Schreiben eines Wirtschaftsprüfers, in dem die erhaltenen Einkünfte aufgeführt sind</li></ul>",We verwachten als voorbeeld:<ul><li>Ondersteunende documenten overeenkomend met de aard van de fondsen</li><li>Getekende brief van een registeraccountant over de verworven inkmen in details</li></ul>
FRONT_END.VALUE.DOCUMENT_TYPE.DESCRIPTIONS.LM_PROOF_OF_MARRIAGE,"Please send us a copy of your marriage contract if you have one, or if not, the marriage certificate. This document is necessary if you have a joint account or in the case of a co-subscription.","En cas de co-souscription, merci de nous transmettre une copie de votre contrat de mariage si établi en prévision de vos prochaines opérations sur votre contrat.","Bitte senden Sie uns eine Kopie Ihres Ehevertrags, wenn Sie einen haben, oder wenn nicht, die Heiratsurkunde. Dieses Dokument ist erforderlich, wenn Sie ein gemeinsames Konto haben oder wenn Sie ein gemeinsames Abonnement abschließen.",Gelieve ons een kopie te versturen van jouw huwelijkscontract of huwelijks certificaat. Dit document is noodzakelijk indien jij een gezamelijke rekening hebt of in geval van een co-onderschrijving.
FRONT_END.VALUE.DOCUMENT_TYPE.DESCRIPTIONS.LM_PROOF_OF_RESIDENCE,"Documents that can be used as proof of residence are for example tax documents, bills dated less than 3 months (electricity, water, ...., mobile phone bills are not accepted).","Les documents pouvant être utilisés comme justificatifs sont par exemple les documents fiscaux, les factures datées de moins de 3 mois (électricité, eau,…. les factures de téléphone portable ne sont pas acceptées).","Dokumente, die als Wohnsitznachweis verwendet werden können, sind z. B. Steuerunterlagen, Rechnungen, die weniger als 3 Monate alt sind (Strom-, Wasser-, ...., Handy-Rechnungen werden nicht akzeptiert).","Documenten die als bewijs van woonplaats kunnen dienen zijn bijvoorbeeld belastingdocumenten, rekeningen van minder dan 3 maanden oud (elektriciteits-, water-, ....- en mobiele telefoonrekeningen worden niet aanvaard)."
FRONT_END.VALUE.DOCUMENT_TYPE.DESCRIPTIONS.LM_PROOF_OF_SALE,"Please provide us with proof of the economic origin of the funds. As proof, we expect for example this type of document depending on the nature of the sale (duly signed document with indication of the amount):<ul><li>Copy of the invoice</li><li>Certificate issued by a lawyer indicating the amount and date of the sale</li><li>Notarised deed of sale indicating the date and amount attributed to the client</li><li>Copy of the deed of sale and mention of the investment on a bank statement</li><li>Extracts of media coverage (if any)</li><li>Cerfa form stamped by the tax authorities or accompanied by the acknowledgement of receipt of the email</li><li>Cerfa form related to the transaction duly registered (if required)</li></ul>","Comme justificatif, nous attendons par exemple ce type de document suivant la nature de la vente (document dûment signé avec indication du montant):<ul><li>Copie de la facture</li><li>Attestation émise par un avocat indiquant le montant et la date de la vente</li><li>Acte de vente notarié indiquant la date et le montant attribué au client</li><li>Copie de l’acte de vente et mention du placement sur un relevé bancaire</li><li>Extraits de couverture médiatique (le cas échéant)</li><li>Cerfa form stamped by the tax authorities or accompanied by the acknowledgement of receipt of the email</li><li>Formulaire cerfa estampillé par l'administration fiscale ou accompagné de l’accusé de réception du mail</li><li>Cerfa en relation avec l'opération dûment enregistré (si requis)</li></ul>","Bitte legen Sie uns einen Nachweis über die wirtschaftliche Herkunft der Gelder vor. Als Nachweis erwarten wir zum Beispiel diese Art von Dokument, je nach Art des Verkaufs (ordnungsgemäß unterzeichnetes Dokument mit Angabe des Betrags):<ul><li>Kopie der Rechnung</li><li>Von einem Rechtsanwalt ausgestellte Bescheinigung, aus der der Betrag und das Datum des Verkaufs hervorgehen</li><li>Notariell beglaubigter Kaufvertrag, aus dem das Datum und der dem Kunden zugewiesene Betrag hervorgehen</li><li>Kopie des Kaufvertrags und Angabe der Investition auf einem Kontoauszug</li><li>Auszüge aus der Medienberichterstattung (falls vorhanden)</li><li>Von den Steuerbehörden abgestempeltes Cerfa-Formular oder zusammen mit der Empfangsbestätigung der E-Mail</li><li>Cerfa-Formular als Bestätigung, dass die Transaktion ordnungsgemäß registriert wurde (falls erforderlich)</li></ul>",Gelieve ons een bewijs te bezorgen van de economische origine van de fondsen. Als bewijs verwachten wij dit type van document (Geldig getekend + indicatie van het bedrag):ul><li>Kopie van de factuur</li><li>Certificaat uitegegeven door een advocaat met datum en bedrag van de verkoop</li><li>Genotariseerde verkoopsakte met datum en bedrag toegekend aan de klant</li><li>Kopie van verkoopsakte en een uittreksel van de investering</li><li>Uittreksels van mediaberichten (indien er zijn)</li><li>Cerfa formulier bestempeld door de belastingsinstanties of door een erkenning van een ontvangstbevestiging per mail</li><li>Een geldig getekend Cerfa formulier met betrekking tot the transactie (indien vereist)</li></ul>
